name,introduction,url
重生异界三皇子叶君,重生异界三皇子叶君全文免费阅读由小兵提供。《重生异界三皇子叶君》梵如风著情节跌宕起伏、扣人心弦，是一本情节与文笔俱佳的热,https://www.bige7.com/book/42905/
三国从救曹操长子开始,历史系学生丁辰穿越到后汉三国时代的宛城，眼看曹军就要大败，曹昂即将被杀。怎么办？在线等，挺急的……,https://www.bige7.com/book/11538/
三国之巅峰召唤,　　看惯了老套的三国争霸，现在来点不一样的。　　东明、西唐、南汉、北元、中宋……　　项羽大战五虎上将，张良智斗鬼谷子，白,https://www.bige7.com/book/36/
我在大唐卖烧烤,意外穿越到了大唐，我干起了老本行卖烧烤，生意惨淡，受人欺凌，直到有一天......Q群422507262,https://www.bige7.com/book/3416/
抗日之幽灵,简介：卫平穿越至硝烟弥漫的抗日战场之上，凭借着高超的战斗力和战术素养，乐文小说网他训练出一支号称幽灵的特种部队，背负着一,https://www.bige7.com/book/9737/
斐潜,没有系统，没有老爷爷，没有推土机，没有集邮癖，只有一个小职员，无财无权无势，一步步的在三国各路牛人间披荆斩棘！枭雄还是英,https://www.bige7.com/book/21903/
从我是特种兵开始嘲讽成神,　　      【日更1万，轻松无敌爽文！】 穿越特种兵，获得神级嘲讽系统。只要嘲讽别人，就能一路变强！……嘲讽龙小云是,https://www.bige7.com/book/3133/
抗战之关山重重,老哲写实风格抗战新书“我们一定会回来的！”有军官对手下数千名官兵说。可是自打他们出关以后，侵略者强大，国尚危急，家又何安,https://www.bige7.com/book/10760/
荡宋,他是武力与智慧的统一体他是东南大地的传奇他在各种身份中自由地切换他是北宋王朝最后的排面他代表着自由浪漫还有一点扯淡回到北,https://www.bige7.com/book/40887/
大叛贼,　　辛亥革命一声炮响震动九州，满清应声而倒 ……　　不对！等等！这是康熙朝？老天你玩我是吧？,https://www.bige7.com/book/1064/
逆流启明,又名大明再起，万里江山岂容建奴践踏？,https://www.bige7.com/book/15788/
抗战之超级山寨工厂txt,军事发烧友高寒意外获得了超强战力，他穿越抗日战争年代，成为了占山为王的土匪，专劫鬼子汉奸，要钱也要命，被称为最牛路霸。,https://www.bige7.com/book/48744/
林松郭小玉,龙之利刃，为国为民，死而后已。血海深仇，神秘龙牙，离奇身世。山林少年林松，遭遇巨变，怀揣龙牙军刀走出大山。一人，一狼，参,https://www.bige7.com/book/27037/
我大明武德充沛但选择文化胜利,　　本书又名《反向入关学的创始者，美洲真正的主人，殷人的救世主，欧罗巴的噩梦，东方文明的最高领袖，第四大明帝国的皇帝，五,https://www.bige7.com/book/2555/
大明合伙人,　　一个偶然的机会，走投无路的沈浪发现自家的仓库居然连接大明皇宫，于是便与大明末代皇帝崇祯有了跨越时空的交际。差点砍了这,https://www.bige7.com/book/3127/
寒门仕子,齐誉，一个穷书生，经商没本钱，致富没门路，只得依靠科举谋求出路。一路走下去，去争做那个笑到最后的人。直到有一天，国家内忧,https://www.bige7.com/book/43116/
我在大唐能签到,林轩意外魂穿大唐，携带签到系统，从此混的风生水起。“叮，签到成功，获得老坛酸菜面一箱。”“叮，签到成功，获得洗发水一瓶。,https://www.bige7.com/book/23732/
特种兵：开局召唤141特遣队,搜小说免费提供作者大秦荣耀的经典小说：《特种兵：开局召唤141特遣队》最新章节全文阅读服务本站更新及时无弹窗广告欢迎光临,https://www.bige7.com/book/23420/
从鬼灭开始的天灾,内容介绍：苏醒在鬼灭之刃的世界，还成为了‘屑师兄’狯岳！既然他变成了狯岳，那他一定要改变所有！已经无法改变的他管不了，但,https://www.bige7.com/book/15041/
三国之小君子,　　首先这不是一部黑刘备的小说。其次一定要看前言，要不然有几个地方你们一定会感觉到是我不懂历史的。总体来说....这是一,https://www.bige7.com/book/3442/
我真没想当皇帝啊,　　我是叶君。　　重生异世夏国，成了夏国三皇子。　　我真没想当皇帝啊。　　奈何实力不允许。　　我太难了！　　普通群：66,https://www.bige7.com/book/2442/
大明王朝1587,　　万历十五，海瑞已死，戚继光病退，张居正一党已被悉数逐斥，申时行正任内阁首辅，李成梁在辽东战战兢兢；努尔哈赤在建州老营,https://www.bige7.com/book/2520/
三国从忽悠刘备开始,　　汉灵帝西园租官，要不要租？租！当然租！因为只要恰好租到灵帝驾崩前的最后一个任期，就等于直接租房租成了房东！租官租成了,https://www.bige7.com/book/1917/
我的意呆利,如果说两次世界大战是一场人类的浩劫的话，那么意大利就是这场浩劫中不多的笑料，让这场残酷的战争多了一丝轻松的意味。不过现在,https://www.bige7.com/book/23070/
叶君楚倾城穿越成三皇子笔趣阁,叶君楚倾城穿越成三皇子笔趣阁全文免费阅读由小兵提供。《叶君楚倾城穿越成三皇子笔趣阁》叶君楚倾城著情节跌宕起伏、扣人心弦，,https://www.bige7.com/book/39855/
新顺1730,　　假如明亡后是一个汉人王朝，会是怎样？　　刘钰穿越后，发现自己来到的，是个历史拐点下的王朝大顺。　　起步就是公爵之子，,https://www.bige7.com/book/3011/
寒门崛起,　　这是一个就业路上屡被蹂躏的古汉语专业研究生，回到了明朝中叶，进入了山村一家幼童身体后的故事。　　木讷父亲泼辣娘，一水,https://www.bige7.com/book/589/
陈凡李云龙,陈凡：李团长，收购坂田信哲，死活不论，三十吨武器弹药。,https://www.bige7.com/book/26997/
谍云重重,　　当发现自己双手沾满了鲜血，怎么办，在线急！当发现自己前身是一个绝对的极品渣人，怎么办，还是急！这是一个自我救赎，一个,https://www.bige7.com/book/3472/
我娘子天下第一,　　柳父：“志儿，去读书吧。”　　柳明志：“我，江南首富长子万贯家财，开玩笑吗？不去，打死都不去。”　　柳父：“管家，取,https://www.bige7.com/book/333/
大明完美暴君,萨尔浒惨败，辽军畏敌如虎，辽东岌岌可危。穿越而来的朱由校立志要做太祖皇帝那样杀伐果断、整顿吏治的狠人。更要学习成祖之风，,https://www.bige7.com/book/28371/
奥特曼开局获得神级卡牌系统,夏龙穿越泽塔奥特曼的世界，获得超神卡片系统，变身帝骑。只要完成任务获得奖励，就能获得拥有特殊力量的卡牌。“哎，奥特曼世界,https://www.bige7.com/book/33034/
大国重坦,为了给父亲正名，秦振华来到了一机厂，从此开始了一段崭新的人生，修坦克，改炮管，造发动机，搞外贸，在那个特殊的年代，一步步,https://www.bige7.com/book/9676/
大秦铁骑,国家衰落，从来不是外族之祸；朝堂之乱，才是国乱根本。一个华夏第一特种兵，从战死他乡到穿越异界，成为大武帝国的六皇子，但显,https://www.bige7.com/book/37653/
蝉动,私家侦探左重回到过去，战斗在敌人的心脏，外号笑面虎，擅长背后一刀，精通玉座金佛原理，斯蒂庞克定式。,https://www.bige7.com/book/7404/
天唐锦绣,　　穿越是一件很有意思的事儿，但是当房俊穿越到那位浑身冒着绿油油光芒的唐朝同名前辈身上，就感觉生活全都不好了……,https://www.bige7.com/book/627/
晋末多少事,严肃版：末晋时节，烽火漫天。杜陵杜氏庶子杜英学成下山，正逢桓温北伐，天下局势风起云涌、动荡不休。试问晋末多少事，安能都付,https://www.bige7.com/book/24876/
公子凶猛," 有幸穿越了，还是生在地主家，此生不缺吃穿却也不想混吃等死，所以傅小官随意的做了些事情，没料到产生的影响如此巨大。
皇帝",https://www.bige7.com/book/2494/
回到民国当医生,外科医生江来未曾料到自己会回到波澜壮阔的年代。可他拿不了枪杆子，只能拿起手术刀，于是，同仁医院的江医生成了那个时代医疗水,https://www.bige7.com/book/7648/
蜀汉之庄稼汉,　　这里讲的是一个平凡的苦逼在乱世三国里苦苦挣扎，努力种田的故事。,https://www.bige7.com/book/231/
猎谍,间谍是一个非常古老的职业，从有战争开始的那一天起，间谍便是交战双方获取对方情报的唯一选择。有人说，间谍战是这个世界上唯一,https://www.bige7.com/book/6983/
回到三国战五胡,当三国演义里的撒豆成兵成了真，当豪桀纵横、熊据虎跱的三国争霸时代，撞上‘五胡’入侵，将会谱写一曲怎样可歌可泣的英雄史？最,https://www.bige7.com/book/22537/
小阁老,　　站在你面前的是：大明王朝的守护者，万历皇帝的亲密战友，内阁首辅的好儿子，十六、十七世纪全球首富。控制吏部三十年的幕后,https://www.bige7.com/book/309/
三国从单骑入荆州开始,　　“生子当如孙仲谋，刘景升儿子若豚犬尔。”初平元年，被曹操称为猪狗儿的刘琦站在宜城的大门外，替他父亲刘表走进了荆州。如,https://www.bige7.com/book/4800/
我是御史，开局痛斥女帝,我是御史，开局痛斥女帝简介：我是御史，开局痛斥女帝情节跌宕起伏、扣人心弦，是一本情节与文笔俱佳的历史军事。,https://www.bige7.com/book/11444/
昭周,　　林昭带着上辈子的记忆，在东湖镇再世为人，然而他面对的处境却并不是十分乐观。一个苛刻的大母，把母子二人压的喘不过气来。,https://www.bige7.com/book/1845/
南宋游记,后世特种兵杜雨晖灵魂意外的穿越到了南宋初年6岁同名孩子的身上，善钓鱼、懂医术、棋艺精湛、因岁数太小唯有通过跟爹娘配合，以,https://www.bige7.com/book/12857/
大明最狠一个山贼,皇太极目光阴冷地望向西南方向，恨恨说道：“我大清将士纵横千里才抢来的钱粮，竟被姓秦那蟊贼反手就抢了去，此贼不除，天下难靖,https://www.bige7.com/book/24004/
从我是特种兵开始一键回收,　　外卖小哥秦渊获得一键回收系统，放进去的物品，可以为自身提供相关的属性和能力！　　放入枪法，获得巅峰枪法，出神入化！放,https://www.bige7.com/book/3180/
秦时小说家,　　（大国记·秦时明月征文金奖作品）　　这里有天下寥寥、苍生涂涂的纵横家！　　这里有修身、齐家、治国、平天下的儒家！　　,https://www.bige7.com/book/3230/
带个地道系统打鬼子,李桓，穿越到抗战年代，意外获得了挖地道的系统，“叮，恭喜完成打检查站的任务，获得四倍镜一个！”“叮，恭喜完成协助主力歼灭,https://www.bige7.com/book/11382/
九叔系列：老子是石坚,我真是石坚，会闪电奔雷拳那个石坚，茅山大师兄。PS：九叔、灵异港片、僵尸道长、我和僵尸有个约会综合世界,https://www.bige7.com/book/9001/
数风流人物,　　瑞根晚明+红楼半架空历史官场养成文，绝对够味！　　大周永隆二年。盛世隐忧。　　四王八公鲜花着锦，文臣武将烈火烹油。　,https://www.bige7.com/book/471/
三国之吕布是我爹吕熙,一朝穿越，回到三国时期！吕熙悲催地发现，吕布居然是他爹！而现在，这位倍儿秀的老爹，正打算刺杀丁原，投效董卓面对岔路口的选,https://www.bige7.com/book/32217/
大明流匪,　　【火爆历史书】大明1619年，萨尔浒之战，杜松兵败后一伙败军逃兵逃离了辽东，逃进关内，一路向西…… 穿越而来的刘恒成,https://www.bige7.com/book/1040/
亮剑从准备狙击山本特工队开始,刘剩穿越到了亮剑世界，成了独立团的一个小兵，想着马上就可以手刃小鬼子，刘剩就兴奋。谁知道，只给三发子弹！后世的小鬼子干了,https://www.bige7.com/book/11367/
东晋北府一丘八,　　历史的车轮滚过波澜壮阔的三国时代，中原大地迎来了百年未遇的和平，人们都以为盛世即将来临，可谁都没想到，等来的却是一场,https://www.bige7.com/book/1372/
从今天开始做藩王,　　一闭眼，一睁眼。赵煦发现自己成了一名皇子。美人妖娆，封地很远，国家很乱。而他只想守着自己的封土逍遥自在。只是若有敌人,https://www.bige7.com/book/4768/
大秦：开局十万熟练度,叮，恭喜剑术精通：大师级！100000熟练度！叮，恭喜箭术精通：大师级！100000熟练度！叮，恭喜长枪精通：大师级！1,https://www.bige7.com/book/32938/
鹰视狼顾,　　这个世界，有门阀世家，有藩镇割据，有虎视眈眈的异族！穿越成大周禁军武官的叶明盛，还没来得及享受权力带来的好处，就要为,https://www.bige7.com/book/2519/
冠冕唐皇,　　大唐垂拱四年，李潼来到这个世界。贵介公子人如玉，不幸生在帝王家。女主临朝，武周革命。不为鱼肉，即为刀俎。名器不假与人,https://www.bige7.com/book/1305/
买来的庄稼汉,《买来的庄稼汉》简介：冯永看看那女娃，头发有些发黄，有些地方甚至打结到了一起，偶尔有虱子爬进爬出，脸上黑黑的，很明显营养,https://www.bige7.com/book/34151/
最强区小队,　　抗战烽火起，神州遍地哀。初来乍到，就是看不惯那遍地的小日本。拉队伍，找组织，我要打鬼子！,https://www.bige7.com/book/2445/
明末国贼,　　洪承畴败降于松锦，孙传庭阵丧于潼关，明朝大厦将倾，神州将沦于蛮夷之手，李兴之按剑上殿，陛下这大明国政还是末将替您打理,https://www.bige7.com/book/3513/
斗罗：我为食神，一拳打懵神王,【免费】【强烈推荐】【单女主】【轻松】【无系统】【爽文】【武魂殿】【无敌文】林辰穿越斗罗大陆，这一世的他天生神力，拥有极,https://www.bige7.com/book/58800/
1635汉风再起,一个未来的灵魂，融合了明末少年的头脑，带着一群溃散的海盗，流落澳洲，并以此为基地，建立一个崭新的世界，让汉风再次吹向世界,https://www.bige7.com/book/14963/
大唐孽子李宽,「历史爽文」熬了个夜，李宽回到了大唐，成为李世民的二儿子楚王李宽。他曾是长安城四害之首，是李世民口中的孽子。他是世家的眼,https://www.bige7.com/book/26579/
赵昊赵守正,站在你面前的是：大明王朝的守护者，万历皇帝的亲密战友，内阁首辅的好儿子，人类文明史上最富有的人。控制吏部三十年的幕后黑手,https://www.bige7.com/book/29754/
我要做秦二世,　　战国之世，天下大争！这一刻，一个伟大的帝国将要建立，这一刻，这个帝国也危在旦夕。在这个苍茫大世，秦公子高大喝：“我要,https://www.bige7.com/book/1246/
逍遥小员外傅小官董书兰,有幸穿越了，还是生在地主家，此生不缺吃穿却也不想混吃等死，所以傅小官随意的做了些事情，没料到产生的影响如此巨大。皇帝要让,https://www.bige7.com/book/17958/
大秦扶苏：开局起兵靖难,公元前210年，秦始皇病逝沙丘。一年之后大泽乡起义，三年后刘邦攻入咸阳，秦朝灭亡。我们的故事从一个现代工科男穿越成为即将,https://www.bige7.com/book/6984/
演武令,　　宣统二年，精武门创立，广收门徒。杨林无拳无勇，面对列强入侵，清帮横行，他只想，活下去……,https://www.bige7.com/book/4238/
从影视剧里当配角开始战斗,酷爱看谍战剧的铁路特警王亮意外获得影视剧最强配角系统，从此走上人生巅峰。王亮“《亮剑》里面的朱子明是我，《悬崖》里面的刘,https://www.bige7.com/book/23411/
带着系统来大唐,　　大唐开元年，这是一个本应该带领华夏开始冲向巅峰的时期，可结局却是安史之乱。　　皇帝李隆基，大唐第四次玄武门之变的主角,https://www.bige7.com/book/2012/
怪物的我被救赎,拥有超能力真的幸福吗？你会选择成为惩恶扬善的暗夜英雄还是做一个默默无闻的平凡之人？读书阁app这是一个发生在平行世界二十,https://www.bige7.com/book/8065/
雪狼强袭林松郭小玉,龙之利刃，为国为民，死而后已。血海深仇，神秘龙牙，离奇身世。山林少年林松，遭遇巨变，怀揣龙牙军刀走出大山。一人，一狼，参,https://www.bige7.com/book/19042/
仙帝重生混都市,仙武大帝九世轮回，只为突破桎梏，却惨遭各路高手围攻灭杀。幸留一缕神识穿越万千位面来到地球，进入已死少年体内，只为除掉心中,https://www.bige7.com/book/28835/
春回大明朝,　　明末，万历年间，非造反文，但也不做忠臣，要做就做让皇帝闭嘴的权臣。陛下但噤声，有臣在！,https://www.bige7.com/book/2532/
盛唐风流,贞观三年冬，西北边城突发瘟疫，加之连年突厥袭扰，邙县内外民不聊生。《盛唐风流》小说推荐：唐残、明朝败家子、汉乡、唐朝小官,https://www.bige7.com/book/12707/
最强之军火商人,　　我若静下心来，世界都要俯首称臣！！每一个人都是他赚钱的工具。 战争之王是人们对他的称呼。但他更愿意人家称呼他为商人，,https://www.bige7.com/book/2677/
大国相,学而优则仕，仕而优则相，相而优则大国。中华民族有一个共同的大国梦，无论是现在还是将来亦或者过去，我们都应该为之奋斗。嘉靖,https://www.bige7.com/book/23085/
雏鹰的荣耀,　　在灾难降临滑铁卢的那一天，穿越者来到了这个世界，成为了不幸的继承者他将改变命运与历史的轨迹，逃离樊笼披荆斩棘，最终将,https://www.bige7.com/book/3637/
疯皇子赵煦九皇子,疯皇子赵煦九皇子全文免费阅读由小兵提供。《疯皇子赵煦九皇子》背着家的蜗牛著情节跌宕起伏、扣人心弦，是一本情节与文笔俱佳的,https://www.bige7.com/book/35201/
都市药王医仙,未婚妻爷爷濒死，李罡拼死救治，却被岳母羞辱污蔑，成为人人唾弃的软饭王，更将他重病母亲断医断药，生死一线！李罡怒然退婚，获,https://www.bige7.com/book/37044/
这个三国很核理,穿越三国，出身堪比张三，武力可斩士卒，智力只在蒋干之下！正一筹莫展之际，你听说县里有个县尉叫刘玄德……那到底是去抱大腿呢,https://www.bige7.com/book/6921/
从今天开始做藩王赵煦张寒,一闭眼，一睁眼。赵煦发现自己成了一名皇子。美人妖娆，封地很远，国家很乱。而他只想守着自己的封土逍遥自在。只是若有敌人敢来,https://www.bige7.com/book/19620/
汉末之风起并州,一名普普通通的宅男穿越汉末，如何能够在这群雄并起的乱世立足？作为穿越者，最大的优势是什么？两千年多年的见识？熟知历史大事,https://www.bige7.com/book/18970/
寒门祸害,　　生于寒门，跃过龙门，跻身仕途。却不与官绅同流，不跟权贵合污，亦不为君主巩固皇权，不承天下乃朱家之天下，不顾太祖训而重,https://www.bige7.com/book/743/
朕就是亡国之君,正统十四年，朱祁钰在皇位上大梦初醒睁开了眼睛。土木堡之变已经发生，三代精锐京营已经全军覆没。自己的哥哥，皇帝中地板砖朱祁,https://www.bige7.com/book/7193/
奋斗在沙俄,穿越成为落魄沙俄大公一路逆袭成为最伟大沙皇的故事。,https://www.bige7.com/book/21931/
亮剑之军工系统,　　退伍军人宁波回到他所熟悉的电视剧成为一名新兵蛋子八路军干部成天叫唤的是啥？李云龙最眼馋的是啥？独立团最需要的是啥？装,https://www.bige7.com/book/2857/
特种兵：开局跟安然相亲,【飞卢小说网独家签约小说：特种兵：开局跟安然相亲】一朝穿越特种兵世界。王燎成为一个普通信息技术员。激活“最强军事系统”，,https://www.bige7.com/book/25864/
三国之最风流,一个年轻人穿越汉末，从亭长做起，争雄天下。数风流人物，还看今朝。群：6225573109796938微信：kniyink,https://www.bige7.com/book/925/
我从亮剑开始崛起,杨麟穿越到亮剑世界，成为红云岭大当家，获得签到打卡系统。系统：先定个小目标，端掉坂田的指挥部！各位书友要是觉得《我从亮剑,https://www.bige7.com/book/22838/
三国幼麟传,汉建安二十四年：时值刘玄德进位汉中王，五虎新封，谋主同堂；关云长水淹七军，威震华夏，毕露锋芒。放眼看，正是烈火烹油，匡扶,https://www.bige7.com/book/50430/
苏程穿越到唐朝,穿越回大唐，却被李世民逼着娶公主，别人是驸马，苏程偏要做诗酒风流举世无双的驸马爷！已有精品完结《明朝小侯爷》《逍遥皇帝打,https://www.bige7.com/book/16250/
我在影视剧里抗敌爆装,正在家里边吃零食，边看最新的抗日神剧的刘飞洋莫名其妙魂穿淞沪抗日战场，并获抽奖系统。击杀鬼子可以获得抽奖机会还可以爆出各,https://www.bige7.com/book/22966/
汉柏,霍嬗，字子侯！冠军景桓侯霍去病遗子！人称奉车子侯，小君侯，小霸王【嗯…是雅称】！,https://www.bige7.com/book/14317/
贞观匹夫,贞观年间，猛将辈出，名臣鹊起。匹夫王恶，不学无术……,https://www.bige7.com/book/29615/
大清隐龙,    大国争锋，总少不了‘弯道超车’的特殊历史时期，从农耕文明到工业革命，然后第一次、第二次、第三次工业革命，每一次科,https://www.bige7.com/book/1615/
贞观极品小女婿,“陛下，管管你女婿韦憨子吧，他又要在东门外单挑那帮大臣！”一个大臣跑到甘露殿对着李世民喊道。“这个韦憨子，简直就是胡闹，,https://www.bige7.com/book/20333/
锦绣大唐之长安房俊房玄龄,穿越是一件很有意思的事儿，但是当房俊穿越到那位浑身冒着绿油油光芒的唐朝同名前辈身上，就感觉生活全都不好了……,https://www.bige7.com/book/16742/
大唐逍遥驸马爷,　　穿越回大唐，却被李世民逼着娶公主，别人是驸马，苏程偏要做诗酒风流举世无双的驸马爷！已有精品完结《明朝小侯爷》《逍遥皇,https://www.bige7.com/book/1286/
神话版三国,　　陈曦看着将一块数百斤巨石撇出去的士卒，无语望苍天，这真的是东汉末年？　　吕布单枪匹马凿穿万人部队，这怎么看都不科学。,https://www.bige7.com/book/637/
大汉：我的外甥是千古一帝,大汉：我的外甥是千古一帝已更新，本站除提供免费在线阅读外（无广告哦），还提供txt电子书下载，《大汉：我的外甥是千古一帝,https://www.bige7.com/book/46530/
贞观三百年,王角穿越了，是唐朝，而且是贞观年间。很好！很有精神！但是……“贞观三百年？蛤？”这是一个已经被穿越者前辈捣烂的唐朝，王角,https://www.bige7.com/book/7710/
墨唐,　　一个当代宅男穿越到初唐一个墨家子弟身上，就像一滴墨水滴在水杯中，很快，整个大唐就被渲染的乌七八黑。,https://www.bige7.com/book/720/
我打造了盛世王朝,“美女，我是一个有节操的男人……”穿越成一个垂死皇子，开局美人在怀，却是来要秦风命的。秦风有一副神奇地图，可以一键删除现,https://www.bige7.com/book/54652/
亮剑：摊牌了，我老李就是有文化,穿越进亮剑世界，成为李云龙后获得全知全能系统！从此以后手握顶级科技知识，打造陆地最强军队！一穷二白没武器？没关系，机械物,https://www.bige7.com/book/14559/
海贼：白胡子海贼团的副船长,拉姆·拉尔森，他是所有海贼眼中的王者，他是海军眼中最强大的敌人。他是白胡子的兄弟，他是所有白胡子海贼团成员口中的“叔叔”,https://www.bige7.com/book/58443/
唐末狐臣,唐末大厦将倾，地方割据，曾经的繁华烽火延绵。那一年，草军纵横江南再图北上。那一年契丹整合内部雄踞北方，向南虎视眈眈。那一,https://www.bige7.com/book/22817/
我在明末有套房,　　明末乱世，天灾人祸，遍地烽火，血流成河。这是一个尸山血海血火交织的年代。这是一个人命贱如蝼蚁的时代。然而，对于全旭来,https://www.bige7.com/book/1439/
木叶的恋爱大师,来自日向一族，却觉醒了写轮眼，又热衷于失恋的奇怪少年，在火之意识的木叶村，读书阁app掀起一场风暴。（简介摘自《木叶の物,https://www.bige7.com/book/8111/
大唐之最强熊孩子,"被废、被贬、惨死？
李承乾表示，这个三连击套餐，小爷不吃。
二十一世纪的理工男穿越到大唐，成为太宗长子李承乾。
开局只有",https://www.bige7.com/book/2956/
